{"id": "DETECT-001", "name": "IAM Privilege Escalation - Admin Policy Attached", "description": "Detects attachment of AdministratorAccess or equivalent policies to any principal", "author": "human", "severity": "critical", "mitre_tactic": "privilege-escalation", "mitre_technique": "T1098.001", "data_source": "cloudtrail", "detection": {"event_source": "iam.amazonaws.com", "event_name": ["AttachUserPolicy", "AttachRolePolicy", "PutUserPolicy", "PutRolePolicy"], "conditions": [{"field": "finding_type", "operator": "contains", "value": "Policy"}]}, "classification_weight": 30, "response": "Verify policy attachment was authorized. If not, detach immediately."}
