{"id": "DETECT-009", "name": "CloudTrail Logging Disabled", "description": "Detects StopLogging calls on any CloudTrail trail - critical defense evasion technique", "author": "human", "severity": "critical", "mitre_tactic": "defense-evasion", "mitre_technique": "T1562.008", "data_source": "cloudtrail", "detection": {"event_source": "cloudtrail.amazonaws.com", "event_name": ["StopLogging", "DeleteTrail"], "conditions": [{"field": "finding_type", "operator": "contains", "value": "CloudTrail"}]}, "classification_weight": 40, "response": "Re-enable CloudTrail immediately. This is a high-confidence indicator of active compromise."}
