{"id": "DETECT-004", "name": "Unusual API Call Volume", "description": "Detects principals making unusually high volumes of API calls indicating reconnaissance or automation abuse", "author": "human", "severity": "medium", "mitre_tactic": "discovery", "mitre_technique": "T1106", "data_source": "guardduty", "detection": {"event_source": "guardduty", "event_name": ["Recon", "Discovery"], "conditions": [{"field": "finding_type", "operator": "contains", "value": "Recon"}]}, "classification_weight": 15, "response": "Review actor activity in CloudTrail. Determine if automated tool or attacker reconnaissance."}
