{"id": "DETECT-005", "name": "GuardDuty High Severity Finding", "description": "Any GuardDuty finding with severity >= 7 warrants immediate investigation", "author": "human", "severity": "high", "mitre_tactic": "multiple", "mitre_technique": "multiple", "data_source": "guardduty", "detection": {"event_source": "guardduty", "event_name": [], "conditions": [{"field": "severity_raw", "operator": "gte", "value": "7"}]}, "classification_weight": 20, "response": "Investigate immediately. GuardDuty high-severity findings have high confidence."}
