{"id": "DETECT-006", "name": "Root Account Usage", "description": "Detects any API call made by the root account - root should never be used for day-to-day operations", "author": "human", "severity": "critical", "mitre_tactic": "privilege-escalation", "mitre_technique": "T1078.004", "data_source": "cloudtrail", "detection": {"event_source": "signin.amazonaws.com", "event_name": ["ConsoleLogin", "RootAccountUsage"], "conditions": [{"field": "principal_arn", "operator": "contains", "value": "root"}]}, "classification_weight": 40, "response": "Root account usage is never expected. Investigate immediately and rotate root credentials."}
