{"id": "DETECT-002", "name": "S3 Data Exfiltration - Bucket Policy Made Public", "description": "Detects S3 bucket policy changes that grant public access", "author": "human", "severity": "critical", "mitre_tactic": "exfiltration", "mitre_technique": "T1537", "data_source": "cloudtrail", "detection": {"event_source": "s3.amazonaws.com", "event_name": ["PutBucketPolicy", "PutBucketAcl", "DeleteBucketPolicy"], "conditions": [{"field": "finding_type", "operator": "contains", "value": "S3"}]}, "classification_weight": 35, "response": "Revert bucket policy to baseline. Enable public access block."}
