{"id": "DETECT-003", "name": "Credential Compromise - Unusual Console Login", "description": "Detects console logins from unusual locations or after hours", "author": "human", "severity": "high", "mitre_tactic": "initial-access", "mitre_technique": "T1078", "data_source": "guardduty", "detection": {"event_source": "guardduty", "event_name": ["UnauthorizedAccess", "CredentialAccess"], "conditions": [{"field": "finding_type", "operator": "contains", "value": "UnauthorizedAccess"}]}, "classification_weight": 25, "response": "Verify login with user. If unauthorized, disable credentials and investigate."}
