{"id": "DETECT-010", "name": "Cross-Account Role Assumption from Unknown Account", "description": "Detects AssumeRole calls from AWS accounts not in the approved list", "author": "human", "severity": "high", "mitre_tactic": "lateral-movement", "mitre_technique": "T1550.001", "data_source": "cloudtrail", "detection": {"event_source": "sts.amazonaws.com", "event_name": ["AssumeRole", "AssumeRoleWithSAML", "AssumeRoleWithWebIdentity"], "conditions": [{"field": "finding_type", "operator": "contains", "value": "AssumeRole"}]}, "classification_weight": 25, "response": "Verify the source account is authorized. If unknown, revoke the role trust policy."}
