{"id": "DETECT-007", "name": "New Admin User Created", "description": "Detects creation of new IAM users with administrative privileges", "author": "human", "severity": "high", "mitre_tactic": "persistence", "mitre_technique": "T1136.001", "data_source": "cloudtrail", "detection": {"event_source": "iam.amazonaws.com", "event_name": ["CreateUser", "CreateLoginProfile"], "conditions": [{"field": "finding_type", "operator": "contains", "value": "Create"}]}, "classification_weight": 25, "response": "Verify user creation was authorized. Check if admin policies were attached."}
