{"id": "DETECT-008", "name": "Security Group Opened to 0.0.0.0/0 on Non-Web Port", "description": "Detects security group ingress rules allowing all traffic on ports other than 80/443", "author": "human", "severity": "high", "mitre_tactic": "defense-evasion", "mitre_technique": "T1562.007", "data_source": "cloudtrail", "detection": {"event_source": "ec2.amazonaws.com", "event_name": ["AuthorizeSecurityGroupIngress"], "conditions": [{"field": "finding_type", "operator": "contains", "value": "SecurityGroup"}]}, "classification_weight": 25, "response": "Revoke the overly permissive rule immediately. Verify no unauthorized access occurred."}
